{
    "@id": "",
    "filename": "",
    "identifier": "",
    "title": "",
    "description": "",
    "submissionDate": "",
    "publicReleaseDate": "",
    "ontologySourceReferences": [],
    "publications": [],
    "people": [],
    "studies": [
      {
        "@id": "",
        "filename": "studies/test/isa.study.xlsx",
        "identifier": "",
        "title": "test",
        "description": "",
        "submissionDate": "",
        "publicReleaseDate": "",
        "publications": [],
        "people": [],
        "studyDesignDescriptors": [],
        "protocols": [
          {
            "@id": "",
            "name": "Breedfides Growth",
            "description": "",
            "uri": "",
            "version": "",
            "parameters": [
              {
                "@id": "",
                "comments": [],
                "parameterName": {
                  "@id": "",
                  "annotationValue": "Year",
                  "termSource": "",
                  "termAccession": "",
                  "comments": []
                }
              },
              {
                "@id": "",
                "comments": [],
                "parameterName": {
                  "@id": "",
                  "annotationValue": "Location",
                  "termSource": "",
                  "termAccession": "",
                  "comments": []
                }
              },
              {
                "@id": "",
                "comments": [],
                "parameterName": {
                  "@id": "",
                  "annotationValue": "Repetition",
                  "termSource": "",
                  "termAccession": "",
                  "comments": []
                }
              },
              {
                "@id": "",
                "comments": [],
                "parameterName": {
                  "@id": "",
                  "annotationValue": "Block",
                  "termSource": "",
                  "termAccession": "",
                  "comments": []
                }
              }
            ],
            "components": [],
            "comments": []
          }
        ],
        "materials": {
          "sources": [
            {
              "@id": "",
              "characteristics": [
                {
                  "Organism": "Triticum aestivum",
                  "Genus": "Triticum",
                  "Species": "aestivum",
                  "Biological_material_latitude": "48.1333333333333",
                  "Biological_material_longitude": "1.13333333333333",
                  "Variety_name": "Actros"
                }
              ]
            },
            {
              "@id": "",
              "characteristics": [
                {
                  "Organism": "Triticum aestivum",
                  "Genus": "Triticum",
                  "Species": "aestivum",
                  "Biological_material_latitude": "50.5",
                  "Biological_material_longitude": "3.83333333333333",
                  "Variety_name": "Actros"
                }
              ]
            },
            {
              "@id": "",
              "characteristics": [
                {
                  "Organism": "Triticum aestivum",
                  "Genus": "Triticum",
                  "Species": "aestivum",
                  "Biological_material_latitude": "50",
                  "Biological_material_longitude": "8.15",
                  "Variety_name": "Actros"
                }
              ]
            },
            {
              "@id": "",
              "characteristics": [
                {
                  "Organism": "Triticum aestivum",
                  "Genus": "Triticum",
                  "Species": "aestivum",
                  "Biological_material_latitude": "50",
                  "Biological_material_longitude": "8.15",
                  "Variety_name": "Actros"
                }
              ]
            },
            {
              "@id": "",
              "characteristics": [
                {
                  "Organism": "Triticum aestivum",
                  "Genus": "Triticum",
                  "Species": "aestivum",
                  "Biological_material_latitude": "50",
                  "Biological_material_longitude": "8.15",
                  "Variety_name": "Actros"
                }
              ]
            },
            {
              "@id": "",
              "characteristics": [
                {
                  "Organism": "Triticum aestivum",
                  "Genus": "Triticum",
                  "Species": "aestivum",
                  "Biological_material_latitude": "48.3333333333333",
                  "Biological_material_longitude": "1.13333333333333",
                  "Variety_name": "Actros"
                }
              ]
            },
            {
              "@id": "",
              "characteristics": [
                {
                  "Organism": "Triticum aestivum",
                  "Genus": "Triticum",
                  "Species": "aestivum",
                  "Biological_material_latitude": "48.3333333333333",
                  "Biological_material_longitude": "1.13333333333333",
                  "Variety_name": "Actros"
                }
              ]
            },
            {
              "@id": "",
              "characteristics": [
                {
                  "Organism": "Triticum aestivum",
                  "Genus": "Triticum",
                  "Species": "aestivum",
                  "Biological_material_latitude": "50",
                  "Biological_material_longitude": "8.15",
                  "Variety_name": "Actros"
                }
              ]
            },
            {
              "@id": "",
              "characteristics": [
                {
                  "Organism": "Triticum aestivum",
                  "Genus": "Triticum",
                  "Species": "aestivum",
                  "Biological_material_latitude": "54.6666666666667",
                  "Biological_material_longitude": "9.03333333333333",
                  "Variety_name": "Actros"
                }
              ]
            }
          ],
          "samples": [
            {
              "@id": "",
              "characteristics": [],
              "factorValues": [],
              "derivesFrom": []
            },
            {
              "@id": "",
              "characteristics": [],
              "factorValues": [],
              "derivesFrom": []
            },
            {
              "@id": "",
              "characteristics": [],
              "factorValues": [],
              "derivesFrom": []
            },
            {
              "@id": "",
              "characteristics": [],
              "factorValues": [],
              "derivesFrom": []
            },
            {
              "@id": "",
              "characteristics": [],
              "factorValues": [],
              "derivesFrom": []
            },
            {
              "@id": "",
              "characteristics": [],
              "factorValues": [],
              "derivesFrom": []
            },
            {
              "@id": "",
              "characteristics": [],
              "factorValues": [],
              "derivesFrom": []
            },
            {
              "@id": "",
              "characteristics": [],
              "factorValues": [],
              "derivesFrom": []
            },
            {
              "@id": "",
              "characteristics": [],
              "factorValues": [],
              "derivesFrom": []
            }
          ],
          "otherMaterials": []
        },
        "processSequence": [
          {
            "@id": "",
            "name": "",
            "executesProtocol": {
              "@id": "",
              "name": "Breedfides Growth",
              "description": "",
              "uri": "",
              "version": "",
              "parameters": [
                {
                  "@id": "",
                  "comments": [],
                  "parameterName": {
                    "@id": "",
                    "annotationValue": "Year",
                    "termSource": "",
                    "termAccession": "",
                    "comments": []
                  }
                },
                {
                  "@id": "",
                  "comments": [],
                  "parameterName": {
                    "@id": "",
                    "annotationValue": "Location",
                    "termSource": "",
                    "termAccession": "",
                    "comments": []
                  }
                },
                {
                  "@id": "",
                  "comments": [],
                  "parameterName": {
                    "@id": "",
                    "annotationValue": "Repetition",
                    "termSource": "",
                    "termAccession": "",
                    "comments": []
                  }
                },
                {
                  "@id": "",
                  "comments": [],
                  "parameterName": {
                    "@id": "",
                    "annotationValue": "Block",
                    "termSource": "",
                    "termAccession": "",
                    "comments": []
                  }
                }
              ],
              "components": [],
              "comments": []
            },
            "parameterValues": [
              {
                "category": {
                  "@id": "",
                  "comments": [],
                  "parameterName": {
                    "@id": "",
                    "annotationValue": "Year",
                    "termSource": "",
                    "termAccession": "",
                    "comments": []
                  }
                },
                "value": "2009",
                "unit": {